{
  "id": "BGA9_text_en",
  "input": {
    "modality": "text",
    "language": "en",
    "content": "Biogas plant BGA9 digests pig slurry and energy-rich solid substrates. A solid feeder with a 55 cubic metre hopper, vertical mixing screws and a weighing system charges digester F1; a round pre-pit (6 m inner diameter, 3 m deep, approx. 85 cubic metres) pumps the pig slurry into F1 with a progressive cavity pump.\n\nDigester F1 has a diameter of 25 m and a wall height of 6 m, three paddle agitators and a dome roof; it is operated mesophilically. The digestate flows into post-digester N1 (also 25 m diameter, 6 m wall height, one paddle and one long-axis agitator, dome roof, heated). From N1 the digestate passes into digestate store G1 (28 m diameter, 6 m wall height, two submersible agitators, unheated) and from there on into the structurally identical, likewise gas-tight digestate store G2 (28 m diameter, 6 m wall height, one submersible agitator, unheated).\n\nThe biogas of all tanks is fed to a CHP unit with a rated electrical output of 400 kW; its waste heat serves the digester heating and the stable buildings. An emergency flare rated 400 cubic metres per hour is available; a condensate shaft and a seepage shaft are connected to F1."
  },
  "regime": "underspecified",
  "reference": {
    "components": [
      {
        "id": "F1",
        "type": "Digester",
        "label": "Fermenter 1",
        "obligation": "given",
        "params": {
          "V_liq": {
            "value": 2651,
            "obligation": "missing_ask",
            "formula": "pi/4*25^2*6 * 0.90 (Fuellgrad)",
            "accept": {"min": 2624, "max": 2678}
          },
          "V_gas": {
            "value": 680,
            "obligation": "missing_ask",
            "accept": {"min": 679, "max": 681},
            "note": "Kuppeldach plus nicht befuellter Kopfraum"
          },
          "T_ad": {"value": 313.15, "obligation": "missing_ask", "accept": {"min": 312.83, "max": 313.47}}
        }
      },
      {
        "id": "N1",
        "type": "Digester",
        "label": "Nachgärer 1",
        "obligation": "given",
        "note": "baugleich zu F1",
        "params": {"_same_as": "F1"}
      },
      {
        "id": "G1",
        "type": "Digester",
        "label": "Gärrestlager 1",
        "obligation": "given",
        "params": {
          "V_liq": {
            "value": 3325,
            "obligation": "missing_ask",
            "formula": "pi/4*28^2*6 * 0.90 (Fuellgrad)",
            "accept": {"min": 3292, "max": 3358}
          },
          "V_gas": {
            "value": 799,
            "obligation": "missing_ask",
            "accept": {"min": 798, "max": 800},
            "note": "gasdicht abgedecktes Lager: Membrandach plus Kopfraum"
          },
          "T_ad": {
            "value": 293.15,
            "obligation": "missing_ask",
            "accept": {"min": 292.85, "max": 293.45},
            "note": "unbeheiztes Lager ~ Umgebungstemperatur"
          }
        }
      },
      {
        "id": "G2",
        "type": "Digester",
        "label": "Gärrestlager 2",
        "obligation": "given",
        "note": "baugleich zu G1 und ebenfalls gasdicht abgedeckt — beide Lager speisen das BHKW, anders als das offene zweite Lager in BGA7",
        "params": {"_same_as": "G1"}
      },
      {"id": "F1_storage", "type": "GasStorage", "obligation": "auto", "auto_created": true},
      {"id": "N1_storage", "type": "GasStorage", "obligation": "auto", "auto_created": true},
      {"id": "G1_storage", "type": "GasStorage", "obligation": "auto", "auto_created": true},
      {"id": "G2_storage", "type": "GasStorage", "obligation": "auto", "auto_created": true},
      {
        "id": "bhkw",
        "type": "CHP",
        "label": "BHKW 400 kW",
        "obligation": "given",
        "params": {
          "P_el_nom": {"value": 400.0, "obligation": "given", "accept": {"min": 399.6, "max": 400.4}},
          "eta_el": {"value": 0.41, "obligation": "missing_ask", "accept": {"min": 0.4096, "max": 0.4104}},
          "eta_th": {"value": 0.44, "obligation": "missing_ask", "accept": {"min": 0.4396, "max": 0.4404}}
        }
      },
      {"id": "bhkw_flare", "type": "Flare", "label": "Notfackel", "obligation": "auto", "auto_created": true}
    ],
    "connections": [
      {"from": "F1", "to": "N1", "type": "liquid", "obligation": "given"},
      {"from": "N1", "to": "G1", "type": "liquid", "obligation": "given"},
      {
        "from": "G1",
        "to": "G2",
        "type": "liquid",
        "obligation": "given",
        "note": "die beiden Lager sind in Reihe geschaltet"
      },
      {"from": "F1", "to": "F1_storage", "type": "gas", "obligation": "auto"},
      {"from": "N1", "to": "N1_storage", "type": "gas", "obligation": "auto"},
      {"from": "G1", "to": "G1_storage", "type": "gas", "obligation": "auto"},
      {"from": "G2", "to": "G2_storage", "type": "gas", "obligation": "auto"},
      {"from": "F1_storage", "to": "bhkw", "type": "gas", "obligation": "inferred"},
      {"from": "N1_storage", "to": "bhkw", "type": "gas", "obligation": "inferred"},
      {"from": "G1_storage", "to": "bhkw", "type": "gas", "obligation": "inferred"},
      {
        "from": "G2_storage",
        "to": "bhkw",
        "type": "gas",
        "obligation": "inferred",
        "note": "auch das zweite Lager ist gasdicht und liefert Gas"
      },
      {"from": "bhkw", "to": "bhkw_flare", "type": "gas", "obligation": "auto"}
    ]
  },
  "oracle": {
    "substrate_feed": "16 t/d Maissilage und 1,5 t/d CCM (Corn-Cob-Mix) über den Feststoffdosierer in F1 sowie 20 m³/d Schweinegülle aus der Vorgrube in F1; N1, G1 und G2 erhalten keinen Frischfeed",
    "bgaa.exists": false,
    "chp.exists": true,
    "bhkw.P_el_nom": 400.0,
    "bhkw.eta_el": 0.41,
    "bhkw.eta_th": 0.44,
    "F1.V_gas": 680,
    "N1.V_gas": 680,
    "G1.V_gas": 799,
    "G2.V_gas": 799,
    "F1.T_ad": 313.15,
    "N1.T_ad": 313.15,
    "G1.T_ad": 293.15,
    "G2.T_ad": 293.15,
    "F1.fill_fraction": 0.9,
    "G1.fill_fraction": 0.9,
    "digestate_cascade": "F1->N1, N1->G1, G1->G2 (beide Lager in Reihe, beide gasdicht)",
    "gas_routing": "Alle vier Behälter — auch das zweite Gärrestlager — speisen das BHKW"
  },
  "metadata": {"difficulty": "medium", "split": "test"}
}
