{
  "id": "BGA7_text_de_full",
  "input": {
    "modality": "text",
    "language": "de",
    "content": "Die Biogasanlage BGA7 ist eine flexibilisierte NawaRo-Anlage mit Schweinegülle-Einsatz und serieller Behälterkaskade. Ein Feststoffdosierer mit 60 m³ Behältervolumen beschickt ausschließlich den ersten Fermenter; eine Vorgrube (8×5 m, ca. 60 m³) fördert die Schweinegülle per Pumpe ebenfalls in F1.\n\nDie Fermenter F1 und F2 sind in Reihe geschaltet und baugleich: je 24 m Durchmesser, 6 m Wandhöhe, drei Paddelrührwerke (F1) bzw. ein Paddel- und ein Langachsrührwerk (F2), Doppelmembrandach mit einem Gasraum (inkl. Kopfraum) von je 610 m³, mesophil bei 40 °C (313,15 K), Füllgrad 90 %. Der Gärrest fließt von F1 nach F2. Am Ablauf von F2 trennt eine Schneckenpresse; die Festphase wird als Einstreu und Dünger vermarktet, die Flüssigphase fließt in das gasdicht abgedeckte Gärrestlager G1 (32 m Durchmesser, 6 m Wandhöhe, zwei Tauchmotorrührwerke, unbeheizt ca. 20 °C / 293,15 K, Füllgrad 90 %, Gasraum inkl. Kopfraum 1.290 m³). Ein zweites, offenes Gärrestlager G2 (36 m Durchmesser, 6 m Wandhöhe, zwei Tauchmotorrührwerke, unbeheizt ca. 20 °C / 293,15 K, Füllgrad 90 %) ohne Gaserfassung dient als saisonaler Puffer und ist mit einer emissionsmindernden Schwimmschicht abgedeckt; da es kein Gasspeicherdach trägt, ist sein Gasraum allein der nicht befüllte Kopfraum von ca. 611 m³.\n\nDas Biogas aus F1, F2 und G1 wird über eine Gassammelleitung zwei Blockheizkraftwerken zugeführt: BHKW 1 mit 250 kW elektrischer Nennleistung läuft in Grundlast (elektrisch 40 %, thermisch 45 %), BHKW 2 mit 550 kW fährt bedarfsgesteuert im Flexbetrieb (elektrisch 42 %, thermisch 43 %); die installierte Leistung beträgt 800 kW bei einer Bemessungsleistung von ca. 480 kW. Die Wärme versorgt ein Nahwärmenetz und eine Getreidetrocknung. Eine Notfackel mit 800 m³/h und ein Kondensatschacht sind vorhanden.\n\nSubstratzufuhr: 20 t/d Maissilage, 4 t/d Zuckerrübensilage und 3 t/d Grassilage über den Feststoffdosierer in F1 sowie 15 m³/d Schweinegülle aus der Vorgrube in F1."
  },
  "regime": "fully_specified",
  "reference": {
    "components": [
      {
        "id": "F1",
        "type": "Digester",
        "label": "Fermenter 1",
        "obligation": "given",
        "params": {
          "V_liq": {
            "value": 2443,
            "obligation": "derivable",
            "formula": "pi/4*24^2*6 * 0.90 (Fuellgrad)",
            "accept": {"min": 2419, "max": 2467}
          },
          "V_gas": {
            "value": 610,
            "obligation": "given",
            "accept": {"min": 609, "max": 611},
            "note": "Doppelmembrandach plus nicht befuellter Kopfraum"
          },
          "T_ad": {"value": 313.15, "obligation": "given", "accept": {"min": 312.83, "max": 313.47}}
        }
      },
      {
        "id": "F2",
        "type": "Digester",
        "label": "Fermenter 2",
        "obligation": "given",
        "note": "baugleich zu F1, in Reihe geschaltet (serielle Kaskade)",
        "params": {"_same_as": "F1"}
      },
      {
        "id": "G1",
        "type": "Digester",
        "label": "Gärrestlager 1",
        "obligation": "given",
        "params": {
          "V_liq": {
            "value": 4343,
            "obligation": "derivable",
            "formula": "pi/4*32^2*6 * 0.90 (Fuellgrad)",
            "accept": {"min": 4300, "max": 4386}
          },
          "V_gas": {
            "value": 1290,
            "obligation": "given",
            "accept": {"min": 1289, "max": 1291},
            "note": "gasdicht abgedecktes Lager: Membrandach plus Kopfraum"
          },
          "T_ad": {
            "value": 293.15,
            "obligation": "given",
            "accept": {"min": 292.85, "max": 293.45},
            "note": "unbeheiztes Lager ~ Umgebungstemperatur"
          }
        }
      },
      {
        "id": "G2",
        "type": "Digester",
        "label": "Gärrestlager 2 (offen)",
        "obligation": "given",
        "params": {
          "V_liq": {
            "value": 5497,
            "obligation": "derivable",
            "formula": "pi/4*36^2*6 * 0.90 (Fuellgrad)",
            "accept": {"min": 5442, "max": 5552}
          },
          "V_gas": {
            "value": 611,
            "obligation": "derivable",
            "formula": "pi/4*36^2*6 * 0.10 (nicht befuellter Kopfraum, kein Speicherdach)",
            "accept": {"min": 610, "max": 612},
            "note": "offenes Lager ohne Gasspeicherdach: der Gasraum ist der nicht befuellte Kopfraum, also pi/4*36^2*6 * 0.10"
          },
          "T_ad": {
            "value": 293.15,
            "obligation": "given",
            "accept": {"min": 292.85, "max": 293.45},
            "note": "unbeheiztes Lager ~ Umgebungstemperatur"
          }
        },
        "note": "saisonaler Puffer ohne Gaserfassung; PyADM1ODE haengt trotzdem einen GasStorage an den Digester, der bewusst ohne Abnehmer bleibt"
      },
      {"id": "F1_storage", "type": "GasStorage", "obligation": "auto", "auto_created": true},
      {"id": "F2_storage", "type": "GasStorage", "obligation": "auto", "auto_created": true},
      {"id": "G1_storage", "type": "GasStorage", "obligation": "auto", "auto_created": true},
      {
        "id": "G2_storage",
        "type": "GasStorage",
        "obligation": "auto",
        "auto_created": true,
        "note": "bleibt ohne Gas-Abnehmer — das Lager ist offen; der Matcher meldet dafuer eine Struktur-Warnung, die hier die Realitaet abbildet"
      },
      {
        "id": "sep",
        "type": "Separator",
        "label": "Separator",
        "obligation": "given",
        "params": {
          "separator_type": {
            "value": "screw_press",
            "obligation": "given",
            "note": "im Input als Schneckenpresse benannt"
          }
        }
      },
      {
        "id": "bhkw1",
        "type": "CHP",
        "label": "BHKW 1 (250 kW, Grundlast)",
        "obligation": "given",
        "params": {
          "P_el_nom": {"value": 250.0, "obligation": "given", "accept": {"min": 249.75, "max": 250.25}},
          "eta_el": {"value": 0.4, "obligation": "given", "accept": {"min": 0.3996, "max": 0.4004}},
          "eta_th": {"value": 0.45, "obligation": "given", "accept": {"min": 0.4495, "max": 0.4505}}
        }
      },
      {
        "id": "bhkw2",
        "type": "CHP",
        "label": "BHKW 2 (550 kW, Flexbetrieb)",
        "obligation": "given",
        "params": {
          "P_el_nom": {"value": 550.0, "obligation": "given", "accept": {"min": 549.45, "max": 550.55}},
          "eta_el": {"value": 0.42, "obligation": "given", "accept": {"min": 0.4196, "max": 0.4204}},
          "eta_th": {"value": 0.43, "obligation": "given", "accept": {"min": 0.4296, "max": 0.4304}}
        }
      },
      {
        "id": "bhkw1_flare",
        "type": "Flare",
        "obligation": "auto",
        "auto_created": true,
        "note": "von add_chp erzeugt; der Input nennt nur eine gemeinsame Notfackel"
      },
      {"id": "bhkw2_flare", "type": "Flare", "obligation": "auto", "auto_created": true}
    ],
    "connections": [
      {"from": "F1", "to": "F2", "type": "liquid", "obligation": "given"},
      {
        "from": "G1",
        "to": "G2",
        "type": "liquid",
        "obligation": "inferred",
        "note": "das offene Lager puffert saisonal hinter dem gasdichten Lager"
      },
      {
        "from": "F2",
        "to": "sep",
        "type": "liquid",
        "obligation": "given",
        "note": "der gesamte Gaerrest laeuft ueber die Presse — es gibt keine direkte Kante F2->G1"
      },
      {
        "from": "sep",
        "to": "G1",
        "type": "liquid",
        "obligation": "given",
        "note": "Fluessigphase in das Lager; die Festphase wird vermarktet und verlaesst das Modell"
      },
      {"from": "F1", "to": "F1_storage", "type": "gas", "obligation": "auto"},
      {"from": "F2", "to": "F2_storage", "type": "gas", "obligation": "auto"},
      {"from": "G1", "to": "G1_storage", "type": "gas", "obligation": "auto"},
      {"from": "G2", "to": "G2_storage", "type": "gas", "obligation": "auto"},
      {"from": "F1_storage", "to": "bhkw1", "type": "gas", "obligation": "inferred"},
      {"from": "F1_storage", "to": "bhkw2", "type": "gas", "obligation": "inferred"},
      {"from": "F2_storage", "to": "bhkw1", "type": "gas", "obligation": "inferred"},
      {"from": "F2_storage", "to": "bhkw2", "type": "gas", "obligation": "inferred"},
      {"from": "G1_storage", "to": "bhkw1", "type": "gas", "obligation": "inferred"},
      {"from": "G1_storage", "to": "bhkw2", "type": "gas", "obligation": "inferred"},
      {"from": "bhkw1", "to": "bhkw1_flare", "type": "gas", "obligation": "auto"},
      {"from": "bhkw2", "to": "bhkw2_flare", "type": "gas", "obligation": "auto"}
    ]
  },
  "metadata": {"difficulty": "easy", "split": "test"}
}
