{
  "id": "BGA8_sketch_full",
  "input": {
    "modality": "hybrid",
    "language": "de",
    "image_path": "BGA8_sketch.png",
    "content": "Der Fermenter F1 und die beiden Nachgärer N1 und N2 werden mesophil bei 41 °C betrieben, das Gärrestlager G1 ist unbeheizt (ca. 20 °C). Der maximale Füllgrad aller vier Behälter beträgt 90 %. Der Gasraum (Kuppeldach plus Kopfraum) beträgt bei F1 385 m³, bei N1 und N2 je 610 m³ und bei G1 719 m³. Das Digestat durchläuft die Behälter streng nacheinander: von F1 in N1, von N1 in N2 und von N2 in G1. Das Biogas aller vier Behälter wird dem BHKW zugeführt (elektrischer Wirkungsgrad 40 %, thermischer Wirkungsgrad 45 %). Eine Biogasaufbereitung und einen Separator gibt es nicht.\n\nSubstratzufuhr: Feststoffe (Maissilage und Grassilage) über den Feststoffdosierer in F1 sowie Rindergülle aus der Vorgrube in F1."
  },
  "regime": "fully_specified",
  "reference": {
    "components": [
      {
        "id": "F1",
        "type": "Digester",
        "label": "Fermenter 1",
        "obligation": "given",
        "params": {
          "V_liq": {
            "value": 1696,
            "obligation": "derivable",
            "formula": "pi/4*20^2*6 * 0.90 (Fuellgrad)",
            "accept": {"min": 1679, "max": 1713}
          },
          "V_gas": {
            "value": 385,
            "obligation": "given",
            "accept": {"min": 384, "max": 386},
            "note": "Kuppeldach plus nicht befuellter Kopfraum"
          },
          "T_ad": {
            "value": 314.15,
            "obligation": "given",
            "accept": {"min": 313.84, "max": 314.46},
            "rationale": "mesophil bei 41 C — der 40-C-Default liegt ausserhalb des Bandes"
          }
        }
      },
      {
        "id": "N1",
        "type": "Digester",
        "label": "Nachgärer 1",
        "obligation": "given",
        "params": {
          "V_liq": {
            "value": 2443,
            "obligation": "derivable",
            "formula": "pi/4*24^2*6 * 0.90 (Fuellgrad)",
            "accept": {"min": 2419, "max": 2467}
          },
          "V_gas": {
            "value": 610,
            "obligation": "given",
            "accept": {"min": 609, "max": 611},
            "note": "Kuppeldach plus Kopfraum; hier wird auch die Luft zur biologischen Entschwefelung eingeblasen"
          },
          "T_ad": {"value": 314.15, "obligation": "given", "accept": {"min": 313.84, "max": 314.46}}
        }
      },
      {
        "id": "N2",
        "type": "Digester",
        "label": "Nachgärer 2",
        "obligation": "given",
        "note": "baugleich zu N1 und dahinter in Reihe geschaltet — zwei Nachgaerer hintereinander gibt es sonst in keiner Anlage des Datensatzes",
        "params": {"_same_as": "N1"}
      },
      {
        "id": "G1",
        "type": "Digester",
        "label": "Gärrestlager",
        "obligation": "given",
        "params": {
          "V_liq": {
            "value": 2867,
            "obligation": "derivable",
            "formula": "pi/4*26^2*6 * 0.90 (Fuellgrad)",
            "accept": {"min": 2838, "max": 2896}
          },
          "V_gas": {"value": 719, "obligation": "given", "accept": {"min": 718, "max": 720}},
          "T_ad": {
            "value": 293.15,
            "obligation": "given",
            "accept": {"min": 292.85, "max": 293.45},
            "note": "unbeheiztes Lager ~ Umgebungstemperatur"
          }
        }
      },
      {"id": "F1_storage", "type": "GasStorage", "obligation": "auto", "auto_created": true},
      {"id": "N1_storage", "type": "GasStorage", "obligation": "auto", "auto_created": true},
      {"id": "N2_storage", "type": "GasStorage", "obligation": "auto", "auto_created": true},
      {"id": "G1_storage", "type": "GasStorage", "obligation": "auto", "auto_created": true},
      {
        "id": "bhkw",
        "type": "CHP",
        "label": "BHKW 300 kW",
        "obligation": "given",
        "params": {
          "P_el_nom": {"value": 300.0, "obligation": "given", "accept": {"min": 299.7, "max": 300.3}},
          "eta_el": {"value": 0.4, "obligation": "given", "accept": {"min": 0.3996, "max": 0.4004}},
          "eta_th": {"value": 0.45, "obligation": "given", "accept": {"min": 0.4495, "max": 0.4505}}
        }
      },
      {"id": "bhkw_flare", "type": "Flare", "label": "Notfackel", "obligation": "auto", "auto_created": true}
    ],
    "connections": [
      {
        "from": "F1",
        "to": "N1",
        "type": "liquid",
        "obligation": "given",
        "note": "streng serielle Kaskade — kein paralleler Zweig"
      },
      {"from": "N1", "to": "N2", "type": "liquid", "obligation": "given"},
      {"from": "N2", "to": "G1", "type": "liquid", "obligation": "given"},
      {"from": "F1", "to": "F1_storage", "type": "gas", "obligation": "auto"},
      {"from": "N1", "to": "N1_storage", "type": "gas", "obligation": "auto"},
      {"from": "N2", "to": "N2_storage", "type": "gas", "obligation": "auto"},
      {"from": "G1", "to": "G1_storage", "type": "gas", "obligation": "auto"},
      {"from": "F1_storage", "to": "bhkw", "type": "gas", "obligation": "inferred"},
      {"from": "N1_storage", "to": "bhkw", "type": "gas", "obligation": "inferred"},
      {"from": "N2_storage", "to": "bhkw", "type": "gas", "obligation": "inferred"},
      {"from": "G1_storage", "to": "bhkw", "type": "gas", "obligation": "inferred"},
      {"from": "bhkw", "to": "bhkw_flare", "type": "gas", "obligation": "auto"}
    ]
  },
  "metadata": {"difficulty": "easy", "split": "test"}
}
