{
  "id": "BGA11_terse_de_full",
  "input": {
    "modality": "text",
    "language": "de",
    "content": "Biogasanlage mit zwei parallel geschalteten, baugleichen Fermentern F1 und F2 (je Wandhöhe 6 m, Innendurchmesser 25 m, Füllgrad 90 %, Gasraum je 680 m³, mesophil 40 °C), einem Nachgärer N1 (Wandhöhe 6 m, Innendurchmesser 29 m, Füllgrad 90 %, Gasraum 995 m³, 40 °C) und einem unbeheizten, gasdicht abgedeckten Gärrestlager G1 (Wandhöhe 6 m, Innendurchmesser 33 m, Füllgrad 90 %, Gasraum 1.400 m³, ca. 20 °C). Digestatstrom: F1 und F2 in N1, N1 in G1. Das Biogas aller vier Behälter wird auf zwei Pfade aufgeteilt: ein BHKW 250 kW (eta_el = 39 %, eta_th = 46 %) und eine Biogasaufbereitung mit 350 m³/h Kapazität, 99 % Methanausbeute und 97 % Methangehalt. Außerdem vorhanden ist eine Notfackel.\n\nSubstratzufuhr: je 21 t/d Maissilage, 2 t/d Grassilage und 4 t/d Rindermist über die Dosierer (Dos 1 in F1, Dos 2 in F2) sowie je 15 m³/d Rindergülle aus der Vorgrube in F1 und F2."
  },
  "regime": "fully_specified",
  "reference": {
    "components": [
      {
        "id": "F1",
        "type": "Digester",
        "label": "Fermenter 1",
        "obligation": "given",
        "params": {
          "V_liq": {
            "value": 2651,
            "obligation": "derivable",
            "formula": "pi/4*25^2*6 * 0.90 (Fuellgrad)",
            "accept": {"min": 2624, "max": 2678}
          },
          "V_gas": {
            "value": 680,
            "obligation": "given",
            "accept": {"min": 679, "max": 681},
            "note": "Kuppeldach plus nicht befuellter Kopfraum"
          },
          "T_ad": {"value": 313.15, "obligation": "given", "accept": {"min": 312.83, "max": 313.47}}
        }
      },
      {
        "id": "F2",
        "type": "Digester",
        "label": "Fermenter 2",
        "obligation": "given",
        "note": "baugleich zu F1 und parallel geschaltet — beide speisen denselben Nachgaerer",
        "params": {"_same_as": "F1"}
      },
      {
        "id": "N1",
        "type": "Digester",
        "label": "Nachgärer 1",
        "obligation": "given",
        "params": {
          "V_liq": {
            "value": 3567,
            "obligation": "derivable",
            "formula": "pi/4*29^2*6 * 0.90 (Fuellgrad)",
            "accept": {"min": 3531, "max": 3603}
          },
          "V_gas": {
            "value": 995,
            "obligation": "given",
            "accept": {"min": 994, "max": 996},
            "note": "Kuppeldach plus Kopfraum; hier wird auch die Luft zur biologischen Entschwefelung eingeblasen"
          },
          "T_ad": {"value": 313.15, "obligation": "given", "accept": {"min": 312.83, "max": 313.47}}
        }
      },
      {
        "id": "G1",
        "type": "Digester",
        "label": "Gärrestlager",
        "obligation": "given",
        "params": {
          "V_liq": {
            "value": 4619,
            "obligation": "derivable",
            "formula": "pi/4*33^2*6 * 0.90 (Fuellgrad)",
            "accept": {"min": 4573, "max": 4665}
          },
          "V_gas": {
            "value": 1400,
            "obligation": "given",
            "accept": {"min": 1399, "max": 1401},
            "note": "gasdicht abgedecktes Lager: Membrandach plus Kopfraum"
          },
          "T_ad": {
            "value": 293.15,
            "obligation": "given",
            "accept": {"min": 292.85, "max": 293.45},
            "note": "unbeheiztes Lager ~ Umgebungstemperatur"
          }
        }
      },
      {"id": "F1_storage", "type": "GasStorage", "obligation": "auto", "auto_created": true},
      {"id": "F2_storage", "type": "GasStorage", "obligation": "auto", "auto_created": true},
      {"id": "N1_storage", "type": "GasStorage", "obligation": "auto", "auto_created": true},
      {"id": "G1_storage", "type": "GasStorage", "obligation": "auto", "auto_created": true},
      {
        "id": "bhkw",
        "type": "CHP",
        "label": "BHKW 250 kW (wärmegeführt)",
        "obligation": "given",
        "note": "deckt den Prozesswaermebedarf inkl. Regeneration der Waschloesung",
        "params": {
          "P_el_nom": {"value": 250.0, "obligation": "given", "accept": {"min": 249.75, "max": 250.25}},
          "eta_el": {"value": 0.39, "obligation": "given", "accept": {"min": 0.3896, "max": 0.3904}},
          "eta_th": {"value": 0.46, "obligation": "given", "accept": {"min": 0.4595, "max": 0.4605}}
        }
      },
      {
        "id": "bgaa",
        "type": "BiogasUpgrading",
        "label": "Biogasaufbereitung 350 m³/h",
        "obligation": "given",
        "note": "zweiter Verwertungspfad neben dem BHKW — im Datensatz die einzige Anlage mit beiden Abnehmern",
        "params": {
          "capacity_m3h": {
            "value": 350.0,
            "obligation": "given",
            "accept": {"min": 349.65, "max": 350.35},
            "note": "Kapazitaet Rohbiogas; im Regelbetrieb laufen ca. 300 m3/h durch"
          },
          "ch4_recovery": {"value": 0.99, "obligation": "given", "accept": {"min": 0.989, "max": 0.991}},
          "ch4_content_out": {"value": 0.97, "obligation": "given", "accept": {"min": 0.969, "max": 0.971}}
        }
      },
      {
        "id": "bhkw_flare",
        "type": "Flare",
        "obligation": "auto",
        "auto_created": true,
        "note": "von add_chp erzeugt; der Input nennt nur eine gemeinsame Notfackel"
      },
      {
        "id": "bgaa_flare",
        "type": "Flare",
        "obligation": "auto",
        "auto_created": true,
        "note": "von add_bgaa erzeugt — deshalb traegt die Anlage zwei Auto-Fackeln"
      }
    ],
    "connections": [
      {"from": "F1", "to": "N1", "type": "liquid", "obligation": "given"},
      {"from": "F2", "to": "N1", "type": "liquid", "obligation": "given"},
      {"from": "N1", "to": "G1", "type": "liquid", "obligation": "given"},
      {"from": "F1", "to": "F1_storage", "type": "gas", "obligation": "auto"},
      {"from": "F2", "to": "F2_storage", "type": "gas", "obligation": "auto"},
      {"from": "N1", "to": "N1_storage", "type": "gas", "obligation": "auto"},
      {"from": "G1", "to": "G1_storage", "type": "gas", "obligation": "auto"},
      {"from": "F1_storage", "to": "bhkw", "type": "gas", "obligation": "inferred"},
      {"from": "F1_storage", "to": "bgaa", "type": "gas", "obligation": "inferred"},
      {"from": "F2_storage", "to": "bhkw", "type": "gas", "obligation": "inferred"},
      {"from": "F2_storage", "to": "bgaa", "type": "gas", "obligation": "inferred"},
      {"from": "N1_storage", "to": "bhkw", "type": "gas", "obligation": "inferred"},
      {"from": "N1_storage", "to": "bgaa", "type": "gas", "obligation": "inferred"},
      {"from": "G1_storage", "to": "bhkw", "type": "gas", "obligation": "inferred"},
      {"from": "G1_storage", "to": "bgaa", "type": "gas", "obligation": "inferred"},
      {"from": "bhkw", "to": "bhkw_flare", "type": "gas", "obligation": "auto"},
      {"from": "bgaa", "to": "bgaa_flare", "type": "gas", "obligation": "auto"}
    ]
  },
  "metadata": {"difficulty": "easy", "split": "test"}
}
